[
  {
    "id": "d7cffd3d-0371-4c87-8732-4bf6a9f51b04",
    "title": "Kinh Anapanasati Sutta: Nghệ Thuật Quán Niệm Hơi Thở Trong Phật Giáo Nguyên Thủy",
    "folder": "kinh-anapanasati-sutta-nghe-thuat-quan-niem-hoi-tho-trong-phat-giao-nguyen-thuy",
    "date": "2026-09-10T14:25:00+07:00",
    "type": "long",
    "language": "vi",
    "mode": "2",
    "voiceStyle": "contemplative",
    "aiModel": "agy",
    "category": "buddhist_life",
    "last_hook_pattern": 1,
    "main_video_content": "Khảo sát toàn diện kinh văn Anapanasati Sutta và hệ thống 16 tầng quán niệm hơi thở trong Phật giáo Nguyên thủy, từ việc nhận diện hơi thở thể lý, lắng dịu cảm thọ và tâm thức cho đến đỉnh cao tuệ giác vô thường giải thoát. Video kết nối lời dạy cổ sơ của Đức Phật tại Đông Viên Lộc Mẫu với các nghiên cứu khoa học thần kinh hiện đại về hệ thần kinh đối giao cảm, mang lại phương pháp thực hành thiền định vững chãi và thiết thực cho đời sống.",
    "youtube_status": "pending",
    "youtube_video_id": null,
    "capcut_created": false,
    "capcut_created_at": null,
    "created_at": "2026-09-10T08:23:14.428+07:00"
  },
  {
    "id": "61911049-cb1e-4f43-b29f-e1afbd3decb6",
    "title": "Đại học Nalanda: Ngọn hải đăng tri thức cổ đại và di sản nghìn năm",
    "folder": "dai-hoc-nalanda-ngon-hai-dang-tri-thuc-co-dai-va-di-san-nghin-nam",
    "date": "2026-09-12T02:34:15.402212+07:00",
    "type": "long",
    "language": "vi",
    "mode": "2",
    "voiceStyle": "contemplative",
    "aiModel": "agy",
    "category": "buddhist_wisdom",
    "last_hook_pattern": 3,
    "main_video_content": "Khám phá lịch sử thăng trầm của Viện Đại học Phật giáo Nalanda tại bang Bihar (Ấn Độ) — trung tâm học thuật đỉnh cao tồn tại suốt tám thế kỷ với thư khố chín tầng Dharmaganja lưu giữ hàng vạn bản kinh lá bối cổ. Video phân tích quy trình khảo hạch nghiêm cẩn của các Môn thần Dvarapala, tinh thần tranh biện triết học tự do giữa các bộ phái, cùng hành trình vượt đèo tuyết Himalaya bảo tồn di sản của các dịch giả Tây Tạng trước biến cố hỏa hoạn thế kỷ 13.",
    "youtube_status": "pending",
    "youtube_video_id": null,
    "capcut_created": false,
    "capcut_created_at": null,
    "created_at": "2026-09-12T02:34:15.402212+07:00"
  }
]